,track_name,textual,numerical
7184,The Boys Of Summer,Don Henley Folk The Boys Of Summer,5.24335
7185,Coastline,Hollow Coves Folk Coastline,4.2012599999999996
7186,Carolina in My Mind,James Taylor Folk Carolina in My Mind,2.9673619999999996
7187,You're My Girl (Lost Recording #6),Mark Diamond Folk You're My Girl (Lost Recording #6),3.715743
7188,Stuck In The Middle With You,Stealers Wheel Folk Stuck In The Middle With You,4.542110999999999
7189,Only Love,Ben Howard Folk Only Love,3.9013700000000004
7190,From Eden,Hozier Folk From Eden,4.169924399999999
7191,Home,Phillip Phillips Folk Home,3.8476116000000005
7192,My Sweet Lord,George Harrison Folk My Sweet Lord,5.3883
7193,The Joker,Steve Miller Band Folk The Joker,4.75850378
7194,Worst of You,Maisie Peters Folk Worst of You,4.358
7195,Chateau,Angus & Julia Stone Folk Chateau,5.2417
7196,Arms,The Paper Kites Folk Arms,3.799500000000001
7197,Lost Without You,Freya Ridings Folk Lost Without You,4.1011999999999995
7198,The Weight - Remastered,The Band Folk The Weight - Remastered,4.433957500000001
7199,Big Yellow Taxi,Joni Mitchell Folk Big Yellow Taxi,4.9866
7200,The Funeral,Band of Horses Folk The Funeral,4.6202
7201,Youth,Daughter Folk Youth,4.203500000000001
7202,Reelin' In The Years,Steely Dan Folk Reelin' In The Years,4.4175
7203,Knockin' On Heaven's Door - Remastered,Bob Dylan Folk Knockin' On Heaven's Door - Remastered,3.8009000000000004
7204,Ends of the Earth,Lord Huron Folk Ends of the Earth,4.163600000000001
7205,Real Peach,Henry Jamison Folk Real Peach,4.150406
7206,Fire and the Flood,Vance Joy Folk Fire and the Flood,3.9142
7207,Leave a Light On,Tom Walker Folk Leave a Light On,3.9983017800000002
7208,Little Talks,Of Monsters and Men Folk Little Talks,3.6875
7209,Old Pine,Ben Howard Folk Old Pine,3.8593
7210,You Are the Best Thing,Ray LaMontagne Folk You Are the Best Thing,4.6206198999999994
7211,"Gone, Gone, Gone","Phillip Phillips Folk Gone, Gone, Gone",4.0283
7212,Like a Rolling Stone,Bob Dylan Folk Like a Rolling Stone,4.824
7213,Hallelujah,Jeff Buckley Folk Hallelujah,4.028136
7214,Real Love Baby,Father John Misty Folk Real Love Baby,4.3004
7215,Happy Together,The Turtles Folk Happy Together,5.3346138
7216,Life in the Fast Lane - Eagles 2013 Remaster,Eagles Folk Life in the Fast Lane - Eagles 2013 Remaster,4.6409694
7217,The Boxer,Simon & Garfunkel Folk The Boxer,4.309839
7218,Where's My Love,SYML Folk Where's My Love,5.320899999999999
7219,Heavy,Birdtalker Folk Heavy,3.6966026399999996
7220,You Can't Hurry Love,The Supremes Folk You Can't Hurry Love,4.9772
7221,House Of The Rising Sun,The Animals Folk House Of The Rising Sun,4.529485
7222,Imagine - Remastered,John Lennon Folk Imagine - Remastered,4.1957
7223,Anchor,Novo Amor Folk Anchor,4.6947
7224,Like Gold,Vance Joy Folk Like Gold,3.907308360000001
7225,Piano Man,Billy Joel Folk Piano Man,4.771703769999999
7226,Summer Breeze,Seals and Crofts Folk Summer Breeze,3.9031000000000002
7227,Jolene,Ray LaMontagne Folk Jolene,3.6973619999999996
7228,Ventura Highway,America Folk Ventura Highway,4.405206
7229,For Island Fires and Family,Dermot Kennedy Folk For Island Fires and Family,3.8131546
7230,Sense of Home,Harrison Storm Folk Sense of Home,3.9344018
7231,Lost in My Mind,The Head and the Heart Folk Lost in My Mind,3.8207120000000003
7232,Vagabond,Caamp Folk Vagabond,4.3816
7233,Lay It On Me,Vance Joy Folk Lay It On Me,4.10160698
7234,You Worry Me,Nathaniel Rateliff & The Night Sweats Folk You Worry Me,4.372800000000001
7235,NFWMB,Hozier Folk NFWMB,5.2007
7236,When the Night is Over,Lord Huron Folk When the Night is Over,4.9002
7237,Recording 15,Shannon Lay Folk Recording 15,3.7879000000000005
7238,"If You Need To, Keep Time On Me","Fleet Foxes Folk If You Need To, Keep Time On Me",3.56654
7239,Ohio,"Crosby, Stills, Nash & Young Folk Ohio",3.8191999999999995
7240,San Luis,Gregory Alan Isakov Folk San Luis,5.2149
7241,Don't Know Why,Norah Jones Folk Don't Know Why,4.4829110000000005
7242,Angela,The Lumineers Folk Angela,4.0468470000000005
7243,The Girl,City and Colour Folk The Girl,3.7069721
7244,The Times They Are A-Changin',Bob Dylan Folk The Times They Are A-Changin',4.656
7245,Heartbeats,José González Folk Heartbeats,4.3123000000000005
7246,Bridge Over Troubled Water,Simon & Garfunkel Folk Bridge Over Troubled Water,3.3019490000000005
7247,Thousand (feat. Lisa Hannigan),Rosie Carney Folk Thousand (feat. Lisa Hannigan),3.8625
7248,Rich Girl,Daryl Hall & John Oates Folk Rich Girl,4.9775
7249,Silver Lining,Mt. Joy Folk Silver Lining,3.4082210000000006
7250,After Rain,Dermot Kennedy Folk After Rain,4.832470000000001
7251,When You Say Nothing At All,Alison Krauss & Union Station Folk When You Say Nothing At All,4.039465
7252,Daylight,Matt and Kim Folk Daylight,3.935356
7253,Jack & Diane,John Mellencamp Folk Jack & Diane,4.061804990000001
7254,Sorry,Aquilo Folk Sorry,3.3594
7255,People Change,Mipso Folk People Change,3.7015999999999996
7256,Dark Days,Local Natives Folk Dark Days,3.8692
7257,Sheep,Mt. Joy Folk Sheep,3.859607000000001
7258,Flowers in Your Hair,The Lumineers Folk Flowers in Your Hair,4.4723673999999995
7259,My Arms Were Always Around You,Peter Bradley Adams Folk My Arms Were Always Around You,4.4793
7260,"Heartless - Recorded At RAK Studios, London","Dermot Kennedy Folk Heartless - Recorded At RAK Studios, London",3.361
7261,The Sound of Silence,Simon & Garfunkel Folk The Sound of Silence,3.57890162
7262,All Is Well,Austin Basham Folk All Is Well,4.014670000000001
7263,Come Away With Me,Norah Jones Folk Come Away With Me,3.5062015199999994
7264,Hero,Family of the Year Folk Hero,3.6165644000000006
7265,Wouldn't It Be Nice - Stereo Mix,The Beach Boys Folk Wouldn't It Be Nice - Stereo Mix,4.77250376
7266,Cringe - Stripped,Matt Maeson Folk Cringe - Stripped,3.9752
7267,Glory,Dermot Kennedy Folk Glory,2.9928010500000006
7268,Listen to the Music,The Doobie Brothers Folk Listen to the Music,5.5356035299999995
7269,White Winter Hymnal,Fleet Foxes Folk White Winter Hymnal,5.29870333
7270,Cat's in the Cradle,Harry Chapin Folk Cat's in the Cradle,3.505
7271,Walking on Broken Glass,Annie Lennox Folk Walking on Broken Glass,4.5171011
7272,Do It Again,Steely Dan Folk Do It Again,5.6576212
7273,All The Time,Bahamas Folk All The Time,5.401770000000001
7274,American Girl,Tom Petty and the Heartbreakers Folk American Girl,5.120527
7275,Nothing Arrived - Live from Spotify London,Villagers Folk Nothing Arrived - Live from Spotify London,4.8935
7276,Mykonos,Fleet Foxes Folk Mykonos,3.2553180000000004
7277,Running on Empty,Jackson Browne Folk Running on Empty,4.9255
7278,50 Ways to Leave Your Lover,Paul Simon Folk 50 Ways to Leave Your Lover,3.5560160000000005
7279,Spirit Cold,Tall Heights Folk Spirit Cold,3.56842
7280,The Joke,Brandi Carlile Folk The Joke,3.21655
7281,Night Moves,Bob Seger Folk Night Moves,4.5743
7282,Rocky Mountain High,John Denver Folk Rocky Mountain High,3.9577999999999998
7283,All We Ever Knew,The Head and the Heart Folk All We Ever Knew,3.8351503000000005
7284,What Could Have Been,Jordan Mackampa Folk What Could Have Been,3.7678019
7285,You and I,Ingrid Michaelson Folk You and I,4.3925
7286,Southern Nights,Glen Campbell Folk Southern Nights,5.8835999999999995
7287,Right Down the Line,Gerry Rafferty Folk Right Down the Line,3.9887300000000003
7288,California Dreamin' - Single Version,The Mamas & The Papas Folk California Dreamin' - Single Version,5.3927
7289,A Case of You,Joni Mitchell Folk A Case of You,4.376799999999999
7290,Big Blue,Vampire Weekend Folk Big Blue,4.09728
7291,Minimum,Charlie Cunningham Folk Minimum,5.901669999999999
7292,Horse to Water,Tall Heights Folk Horse to Water,5.3406
7293,Wait by the River,Lord Huron Folk Wait by the River,4.493
7294,Now You're Gone (feat. Zara Larsson),Tom Walker Folk Now You're Gone (feat. Zara Larsson),5.885075199999999
7295,Hello My Old Heart,The Oh Hellos Folk Hello My Old Heart,3.6078
7296,Mystery of Love (From the Original Motion Picture “Call Me by Your Name”),Sufjan Stevens Folk Mystery of Love (From the Original Motion Picture “Call Me by Your Name”),4.894
7297,Gravity,Sara Bareilles Folk Gravity,4.1236
7298,I Can't Make You Love Me,Bonnie Raitt Folk I Can't Make You Love Me,4.7039965
7299,The Breach,Dustin Tebbutt Folk The Breach,4.393199999999999
7300,Already Gone,Sleeping At Last Folk Already Gone,3.7939045599999996
7301,Re: Stacks,Bon Iver Folk Re: Stacks,4.2299999999999995
7302,The Only Thing,Sufjan Stevens Folk The Only Thing,4.2685
7303,I Feel the Earth Move,Carole King Folk I Feel the Earth Move,5.4985599999999994
7304,Cocaine Jesus,Rainbow Kitten Surprise Folk Cocaine Jesus,3.7111
7305,"Portland, Maine","Donovan Woods Folk Portland, Maine",3.7956000000000003
7306,One of These Nights - Eagles 2013 Remaster,Eagles Folk One of These Nights - Eagles 2013 Remaster,4.228400000000001
7307,First,Cold War Kids Folk First,4.10880624
7308,Used To Be,Matt Nathanson Folk Used To Be,3.6629
7309,Waiting Around - Acoustic,Aisha Badru Folk Waiting Around - Acoustic,3.6143100000000006
7310,Motion Sickness,Phoebe Bridgers Folk Motion Sickness,4.5073
7311,Cecilia,Simon & Garfunkel Folk Cecilia,4.660213100000001
7312,Big Black Car,Gregory Alan Isakov Folk Big Black Car,3.83205
7313,Hallucinogenics,Matt Maeson Folk Hallucinogenics,4.0987
7314,Kill Of The Night,Gin Wigmore Folk Kill Of The Night,4.150142000000001
7315,You've Got a Friend,James Taylor Folk You've Got a Friend,3.8268999999999997
7316,Devil Like Me,Rainbow Kitten Surprise Folk Devil Like Me,4.7970706
7317,Sister,Haux Folk Sister,3.8728130000000003
7318,Back to Autumn,Tall Heights Folk Back to Autumn,3.6954900000000004
7319,Moondance,Van Morrison Folk Moondance,4.6259083
7320,Young & Free,Dermot Kennedy Folk Young & Free,3.6057000000000006
7321,Rose Petals,S. Carey Folk Rose Petals,3.84737
7322,The Stable Song,Gregory Alan Isakov Folk The Stable Song,4.1077200000000005
7323,Oceans,Seafret Folk Oceans,4.47430863
7324,Jenny Jenkins,Mt. Joy Folk Jenny Jenkins,3.4233000000000002
7325,Sister Golden Hair,America Folk Sister Golden Hair,3.826843
7326,Old Time Rock & Roll,Bob Seger Folk Old Time Rock & Roll,5.164999999999999
7327,Walking Back To Georgia,Jim Croce Folk Walking Back To Georgia,5.358754000000001
7328,Astrovan,Mt. Joy Folk Astrovan,4.5664
7329,"Touch The Sky - From ""Brave""/Soundtrack","Julie Fowlis Folk Touch The Sky - From ""Brave""/Soundtrack",3.14
7330,Heal,Tom Odell Folk Heal,2.98246
7331,little light - acoustic version,Lewis Watson Folk little light - acoustic version,4.2491
7332,State Lines,Novo Amor Folk State Lines,4.2013
7333,Step,Vampire Weekend Folk Step,4.459007789999999
7334,Lost In The Light,Bahamas Folk Lost In The Light,3.4043000000000005
7335,Kokomo,The Beach Boys Folk Kokomo,4.0693
7336,Love Brought Weight,Old Sea Brigade Folk Love Brought Weight,3.5403000000000007
7337,Old Friend,Darlingside Folk Old Friend,3.9724999999999997
7338,Party Of One (feat. Sam Smith),Brandi Carlile Folk Party Of One (feat. Sam Smith),3.68961
7339,Sinking Ship,Wild Child Folk Sinking Ship,4.2246
7340,1234,Feist Folk 1234,3.69030199
7341,I Need My Girl,The National Folk I Need My Girl,5.1068999999999996
7342,Something To Remember - Piano Score,Haux Folk Something To Remember - Piano Score,5.216500000000001
7343,America,Simon & Garfunkel Folk America,3.33390662
7344,Good Kisser,Lake Street Dive Folk Good Kisser,3.9257800000000005
7345,Ain't No Man,The Avett Brothers Folk Ain't No Man,4.495
7346,Long Cool Woman (In a Black Dress) - 1999 Remaster,The Hollies Folk Long Cool Woman (In a Black Dress) - 1999 Remaster,5.02821
7347,Nobody,Mitski Folk Nobody,3.7184
7348,Ramblin' Man,The Allman Brothers Band Folk Ramblin' Man,5.28304
7349,Peace Train,Yusuf / Cat Stevens Folk Peace Train,3.8752381000000002
7350,Pink Moon,Nick Drake Folk Pink Moon,3.8068000000000004
7351,Can't Fight This Feeling,REO Speedwagon Folk Can't Fight This Feeling,3.6843182
7352,Arsonist's Lullabye,Hozier Folk Arsonist's Lullabye,4.2437000000000005
7353,"I Can't Help Myself (Sugar Pie, Honey Bunch)","Four Tops Folk I Can't Help Myself (Sugar Pie, Honey Bunch)",4.560899999999999
7354,Die Young,Sylvan Esso Folk Die Young,3.8576400000000004
7355,Way With Words,Bahamas Folk Way With Words,5.5347800000000005
7356,Even the Darkness Has Arms,The Barr Brothers Folk Even the Darkness Has Arms,4.867900000000001
7357,Boston,Dermot Kennedy Folk Boston,3.3396500000000002
7358,Yours to Keep,Jordan Mackampa Folk Yours to Keep,3.7484999999999995
7359,S.O.B.,Nathaniel Rateliff & The Night Sweats Folk S.O.B.,4.08051
7360,Follow My Voice,Julie Byrne Folk Follow My Voice,3.2653438
7361,Sweetest Thing,Allman Brown Folk Sweetest Thing,4.003097299999999
7362,Coffee,Sylvan Esso Folk Coffee,3.28722
7363,Vienna,Billy Joel Folk Vienna,4.085699999999999
7364,Slow It Down,The Lumineers Folk Slow It Down,3.2073
7365,Baba O'Riley,The Who Folk Baba O'Riley,4.4887
7366,Our House,"Crosby, Stills, Nash & Young Folk Our House",4.0479546
7367,Headlights - Stripped,Nick Wilson Folk Headlights - Stripped,3.6459
7368,Memorized,Mat Kearney Folk Memorized,4.938313
7369,Call It Dreaming,Iron & Wine Folk Call It Dreaming,4.2240566
7370,Scott Street,Phoebe Bridgers Folk Scott Street,4.3318
7371,Unbelievers,Vampire Weekend Folk Unbelievers,4.669529
7372,She's Always a Woman,Billy Joel Folk She's Always a Woman,4.310073
7373,Coins,Local Natives Folk Coins,3.7326000000000006
7374,Dirty Work,Steely Dan Folk Dirty Work,3.949307
7375,Annie's Song,John Denver Folk Annie's Song,4.34873
7376,I'm With You,Vance Joy Folk I'm With You,3.8263015800000013
7377,Over my head,Judah & the Lion Folk Over my head,4.208799999999999
7378,No Right To Love You - Acoustic,Rhys Lewis Folk No Right To Love You - Acoustic,4.3376
7379,3 Rounds and a Sound,Blind Pilot Folk 3 Rounds and a Sound,3.3929600000000004
7380,Breathe (2 AM),Anna Nalick Folk Breathe (2 AM),3.8629
7381,2 / 14,The Band CAMINO Folk 2 / 14,4.3649000000000004
7382,Centerfold,The J. Geils Band Folk Centerfold,4.840600000000001
7383,Mountain Sound,Of Monsters and Men Folk Mountain Sound,4.5053600000000005
7384,Do You Believe in Magic?,The Lovin' Spoonful Folk Do You Believe in Magic?,4.4724
7385,Berlin,RY X Folk Berlin,3.0876000000000006
7386,It's Called: Freefall,Rainbow Kitten Surprise Folk It's Called: Freefall,4.4883
7387,Sara Smile,Daryl Hall & John Oates Folk Sara Smile,4.601494
7388,The Sounds of Silence - Acoustic Version,Simon & Garfunkel Folk The Sounds of Silence - Acoustic Version,3.7440999999999995
7389,Peace of Mind,Boston Folk Peace of Mind,4.1433855
7390,Dearly Departed (feat. Esmé Patterson),Shakey Graves Folk Dearly Departed (feat. Esmé Patterson),4.009
7391,Keep on Loving You - Remastered,REO Speedwagon Folk Keep on Loving You - Remastered,4.0379
7392,My Repair,Sons Of The East Folk My Repair,3.9429000000000003
7393,"Flightless Bird, American Mouth","Iron & Wine Folk Flightless Bird, American Mouth",4.1718
7394,Misty,Caamp Folk Misty,3.6631700000000005
7395,Good Vibrations - Remastered,The Beach Boys Folk Good Vibrations - Remastered,4.867624
7396,Take It All Back 2.0,Judah & the Lion Folk Take It All Back 2.0,4.1628384
7397,Such Great Heights - Remastered,The Postal Service Folk Such Great Heights - Remastered,4.2036
7398,Suit And Jacket,Judah & the Lion Folk Suit And Jacket,3.6291166
7399,Another Story,The Head and the Heart Folk Another Story,3.4612999999999996
7400,Alps,Novo Amor Folk Alps,3.8495999999999997
7401,Someone To You,BANNERS Folk Someone To You,4.15765
7402,Someone To Stay,Vancouver Sleep Clinic Folk Someone To Stay,3.7347435
7403,Everything I Own,Bread Folk Everything I Own,3.6182000000000003
7404,California,Joni Mitchell Folk California,4.1156999999999995
7405,"Welcome Home, Son","Radical Face Folk Welcome Home, Son",5.2117
7406,Big Iron,Marty Robbins Folk Big Iron,5.7081
7407,Dirty Paws,Of Monsters and Men Folk Dirty Paws,3.081
7408,pictures (feat. Kacey Musgraves),Judah & the Lion Folk pictures (feat. Kacey Musgraves),3.626642
7409,You're the Inspiration - 2006 Remaster,Chicago Folk You're the Inspiration - 2006 Remaster,4.0893999999999995
7410,Hold You in My Arms,Ray LaMontagne Folk Hold You in My Arms,3.6386060000000002
7411,Wandering Child,Wild Rivers Folk Wandering Child,3.75590193
7412,Moments Passed,Dermot Kennedy Folk Moments Passed,4.8342222
7413,Our Remains,Beta Radio Folk Our Remains,5.179399999999999
7414,Nobody Knows,The Lumineers Folk Nobody Knows,3.5144
7415,Homeward Bound,Simon & Garfunkel Folk Homeward Bound,3.866
7416,Nothing Compares 2 U,Sinéad O'Connor Folk Nothing Compares 2 U,3.5498233
7417,Humbug Mountain Song,Fruit Bats Folk Humbug Mountain Song,5.525599999999999
7418,Poison & Wine,The Civil Wars Folk Poison & Wine,3.2058729999999995
7419,Baker Street,Gerry Rafferty Folk Baker Street,3.5355999999999996
7420,Walls,The Lumineers Folk Walls,3.8363000000000005
7421,"Don't Think Twice, It's All Right","Bob Dylan Folk Don't Think Twice, It's All Right",4.0158
7422,I'm The Only One,Melissa Etheridge Folk I'm The Only One,3.2577
7423,Girl from the North Country (with Johnny Cash),Bob Dylan Folk Girl from the North Country (with Johnny Cash),3.527397
7424,Angel of Small Death and the Codeine Scene,Hozier Folk Angel of Small Death and the Codeine Scene,3.2766725
7425,Every Time I Hear That Song,Brandi Carlile Folk Every Time I Hear That Song,3.55920329
7426,Margaritaville,Jimmy Buffett Folk Margaritaville,4.62645
7427,"Sugar, Sugar","The Archies Folk Sugar, Sugar",5.2418
7428,King And Lionheart,Of Monsters and Men Folk King And Lionheart,3.45682
7429,Suite: Judy Blue Eyes - Remastered,"Crosby, Stills & Nash Folk Suite: Judy Blue Eyes - Remastered",3.8896
7430,So Cool,Caamp Folk So Cool,4.2664
7431,Dylan Thomas,Better Oblivion Community Center Folk Dylan Thomas,3.753039
7432,Carry You,Novo Amor Folk Carry You,3.278500000000001
7433,Sundown,Gordon Lightfoot Folk Sundown,3.8483104000000004
7434,Tangled up in Blue,Bob Dylan Folk Tangled up in Blue,3.7535011600000003
7435,And It Stoned Me,Van Morrison Folk And It Stoned Me,3.5494352
7436,You Were Meant For Me,Jewel Folk You Were Meant For Me,4.15770148
7437,Meet Me in the Woods,Lord Huron Folk Meet Me in the Woods,5.5206
7438,Danny's Song,Loggins & Messina Folk Danny's Song,3.9004
7439,Come A Little Bit Closer,Jay & The Americans Folk Come A Little Bit Closer,5.2845
7440,The Wind,Yusuf / Cat Stevens Folk The Wind,4.342700000000001
7441,Band On The Run - Remastered 2010,Paul McCartney Folk Band On The Run - Remastered 2010,4.02242
7442,Amsterdam - Recorded at Spotify Studios NYC,Mandolin Orange Folk Amsterdam - Recorded at Spotify Studios NYC,4.0296
7443,Tiger Striped Sky,Roo Panes Folk Tiger Striped Sky,3.9721999999999995
7444,Girl - Acoustic,SYML Folk Girl - Acoustic,4.0276
7445,Caught Up In You,38 Special Folk Caught Up In You,5.070107
7446,Power Over Me - Acoustic,Dermot Kennedy Folk Power Over Me - Acoustic,5.4624
7447,Across the Sea,The Sweeplings Folk Across the Sea,3.52620606
7448,Blowin' In the Wind,Bob Dylan Folk Blowin' In the Wind,3.8857231999999997
7449,Blood Bank,Bon Iver Folk Blood Bank,3.9907
7450,If You Leave Me Now - Remastered,Chicago Folk If You Leave Me Now - Remastered,3.5499280000000004
7451,Johnny B. Goode,Chuck Berry Folk Johnny B. Goode,5.7887548
7452,Visions of China,The Lumineers Folk Visions of China,4.7139279
7453,Elijah,Matthew And The Atlas Folk Elijah,4.696899999999999
7454,Time In A Bottle,Jim Croce Folk Time In A Bottle,3.9313000000000002
7455,Spirits,The Strumbellas Folk Spirits,3.8644999999999996
7456,Visions of Gideon,Sufjan Stevens Folk Visions of Gideon,4.5209
7457,You Come First (feat. Saweetie),Zak Abel Folk You Come First (feat. Saweetie),4.3821
7458,Naked as We Came,Iron & Wine Folk Naked as We Came,4.0307
7459,Mary Jane's Last Dance,Tom Petty and the Heartbreakers Folk Mary Jane's Last Dance,5.323001339999999
7460,Hurricane,Bob Dylan Folk Hurricane,4.5939000000000005
7461,Silhouette,Aquilo Folk Silhouette,3.1709
7462,The Way It Is,Bruce Hornsby Folk The Way It Is,4.4768
7463,Feel Like Makin' Love - 2015 Remastered Version,Bad Company Folk Feel Like Makin' Love - 2015 Remastered Version,4.64979
7464,Your Dog,Soccer Mommy Folk Your Dog,5.06559
7465,Never in My Wildest Dreams,Dan Auerbach Folk Never in My Wildest Dreams,3.9594000000000005
7466,"June, After Dark","Elliot Root Folk June, After Dark",3.4406800000000004
7467,The Trouble with Wanting,Joy Williams Folk The Trouble with Wanting,3.7472000000000003
7468,I Saw You Close Your Eyes,Local Natives Folk I Saw You Close Your Eyes,3.5256377000000003
7469,Time After Time,Iron & Wine Folk Time After Time,4.4272
7470,Turning Page,Sleeping At Last Folk Turning Page,3.8691000000000004
7471,Surfin' U.S.A. - Remastered,The Beach Boys Folk Surfin' U.S.A. - Remastered,5.452000000000001
7472,Smother,Daughter Folk Smother,3.2331000000000003
7473,29 #Strafford APTS,Bon Iver Folk 29 #Strafford APTS,3.645
7474,Sunny Came Home,Shawn Colvin Folk Sunny Came Home,5.012519999999999
7475,I'm Your Wreck,Mt. Joy Folk I'm Your Wreck,3.7735024200000007
7476,Midnight Rider,The Allman Brothers Band Folk Midnight Rider,4.2816
7477,Down in the Valley,The Head and the Heart Folk Down in the Valley,3.3094
7478,First Class,Rainbow Kitten Surprise Folk First Class,3.4292
7479,Build Me Up From Bones,Sarah Jarosz Folk Build Me Up From Bones,3.7188689999999998
7480,Wouldn't It Be Nice - Remastered,The Beach Boys Folk Wouldn't It Be Nice - Remastered,4.2217254
7481,The Only Living Boy in New York,Simon & Garfunkel Folk The Only Living Boy in New York,3.2846
7482,Can't You See,The Marshall Tucker Band Folk Can't You See,4.501340000000001
7483,You Had Your Soul with You,The National Folk You Had Your Soul with You,3.8366
7484,The Story,Brandi Carlile Folk The Story,3.08650378
7485,Life's Been Good,Joe Walsh Folk Life's Been Good,3.89625
7486,Darling,Real Estate Folk Darling,4.15987
7487,I Will Spend My Whole Life Loving You,Imaginary Future Folk I Will Spend My Whole Life Loving You,3.8114999999999997
7488,Fortune - Acoustic,William Fitzsimmons Folk Fortune - Acoustic,3.2402000000000006
7489,Moment's Silence (Common Tongue),Hozier Folk Moment's Silence (Common Tongue),3.2843000000000004
7490,Don't Dream It's Over,The Head and the Heart Folk Don't Dream It's Over,3.4369020100000003
7491,Souvenir,Julien Baker Folk Souvenir,4.982999999999999
7492,In a Week (feat. Karen Cowley),Hozier Folk In a Week (feat. Karen Cowley),3.4351075100000004
7493,All the Debts I Owe,Caamp Folk All the Debts I Owe,3.7361900000000006
7494,Fresh Roses,Juke Ross Folk Fresh Roses,4.879700000000001
7495,The Mountain,Ed Prosek Folk The Mountain,3.6896011399999997
7496,If Not For You (Demo),Shakey Graves Folk If Not For You (Demo),3.913179999999999
7497,Tupelo Honey,Van Morrison Folk Tupelo Honey,3.6673329000000003
7498,One Drink,Picture This Folk One Drink,4.39870179
7499,Kin,Penny and Sparrow Folk Kin,3.016174
7500,Thank God I'm a Country Boy,John Denver Folk Thank God I'm a Country Boy,4.63364
7501,Kings & Queens,Mat Kearney Folk Kings & Queens,3.9173999999999998
7502,Doctor My Eyes,Jackson Browne Folk Doctor My Eyes,3.4611569999999996
7503,Soul Meets Body,Death Cab for Cutie Folk Soul Meets Body,5.04630326
7504,Promise,Ben Howard Folk Promise,4.4744
7505,Sweet Baby James,James Taylor Folk Sweet Baby James,3.4362999999999997
7506,Hannah Hunt,Vampire Weekend Folk Hannah Hunt,3.853922
7507,It's Too Late,Carole King Folk It's Too Late,5.59382
7508,Life Is Confusing,Langhorne Slim Folk Life Is Confusing,3.7815499999999997
7509,Ways To Go,Grouplove Folk Ways To Go,3.6215270000000004
7510,Wildflowers,Tom Petty Folk Wildflowers,3.7911228999999995
7511,Macaroni Song,Corey Kilgannon Folk Macaroni Song,3.5533016199999996
7512,Bees,The Ballroom Thieves Folk Bees,3.5282
7513,Speak Too Soon,Wild Rivers Folk Speak Too Soon,3.890716
7514,The Woods - Acoustic,Hollow Coves Folk The Woods - Acoustic,4.033430999999999
7515,You Don't Know How It Feels,Tom Petty Folk You Don't Know How It Feels,4.459199999999999
7516,Gotta Get Up - Remastered,Harry Nilsson Folk Gotta Get Up - Remastered,4.0283
7517,Time Of The Season (Mono Version),The Zombies Folk Time Of The Season (Mono Version),5.427601580000001
7518,Julia,Mt. Joy Folk Julia,3.6028
7519,Lady Lie,Rainbow Kitten Surprise Folk Lady Lie,4.5199
7520,White Rabbit,Jefferson Airplane Folk White Rabbit,3.509873
7521,For Now,Kina Grannis Folk For Now,3.7314
7522,Hungry Eyes,Eric Carmen Folk Hungry Eyes,4.0534
7523,Beige,Yoke Lore Folk Beige,4.2216
7524,The Time I've Wasted,Lori McKenna Folk The Time I've Wasted,3.6674883000000005
7525,Vincent,Don McLean Folk Vincent,3.72520533
7526,Shake,The Head and the Heart Folk Shake,4.762299999999999
7527,Not Giving In,Tom Walker Folk Not Giving In,5.770300000000001
7528,Flume,Bon Iver Folk Flume,3.2843
7529,"Oh, Pretty Woman","Roy Orbison Folk Oh, Pretty Woman",5.0863
7530,Stay Alive,José González Folk Stay Alive,4.3889
7531,Ether Garden,Henry Jamison Folk Ether Garden,3.5633920000000003
7532,King of Carrot Flowers Pt. 1,Neutral Milk Hotel Folk King of Carrot Flowers Pt. 1,4.1964
7533,Heart Attack,Wild Rivers Folk Heart Attack,3.5353110000000005
7534,Helplessly Hoping,"Crosby, Stills & Nash Folk Helplessly Hoping",4.1191
7535,Feel Alive,Katie Herzig Folk Feel Alive,4.0562000000000005
7536,Mystery of Love,Sufjan Stevens Folk Mystery of Love,4.756
7537,Truly Madly Deeply - Recorded at Spotify Studios NYC,Yoke Lore Folk Truly Madly Deeply - Recorded at Spotify Studios NYC,4.952
7538,Paint,The Paper Kites Folk Paint,3.33747
7539,I Got A Name,Jim Croce Folk I Got A Name,4.0897429999999995
7540,Better Than Today,Rhys Lewis Folk Better Than Today,3.6643000000000003
7541,Blue Ridge Mountains,Fleet Foxes Folk Blue Ridge Mountains,4.538245000000001
7542,Sisyphus,Andrew Bird Folk Sisyphus,4.832616999999999
7543,All My Days,Alexi Murdoch Folk All My Days,4.3773
7544,Find a Way,Quiet Arrows Folk Find a Way,3.5822000000000003
7545,On My Own,Whitney Folk On My Own,5.154930000000001
7546,Rosyln,Bon Iver Folk Rosyln,4.6083
