,track_name,textual,numerical
5081,Omaha,Toro y Moi Dance Omaha,3.5295
5082,Mona Lisa,Sabrina Carpenter Dance Mona Lisa,4.7821
5083,Came To Do,Chris Brown Dance Came To Do,3.5685999999999996
5084,Things Can Only Get Better,Howard Jones Dance Things Can Only Get Better,4.074617
5085,She's Not Him,Miley Cyrus Dance She's Not Him,2.7140999999999993
5086,Wrist Watch (feat. Tory Lanez),Trey Songz Dance Wrist Watch (feat. Tory Lanez),3.8499000000000008
5087,You Be Love (feat. Billy Raffoul),Avicii Dance You Be Love (feat. Billy Raffoul),4.83011
5088,Werk,CID Dance Werk,4.6153
5089,New Rules - Alison Wonderland Remix,Dua Lipa Dance New Rules - Alison Wonderland Remix,4.10142
5090,"Heatstroke (feat. Young Thug, Pharrell Williams & Ariana Grande)","Calvin Harris Dance Heatstroke (feat. Young Thug, Pharrell Williams & Ariana Grande)",5.4818999999999996
5091,Superhuman (feat. Keri Hilson),Chris Brown Dance Superhuman (feat. Keri Hilson),3.4678
5092,Human,Maggie Lindemann Dance Human,3.922115
5093,Good Lovin,Ludacris Dance Good Lovin,4.00100105
5094,Si Me Das Tu Amor,Carlos Vives Dance Si Me Das Tu Amor,4.802299999999999
5095,"Crazy, Classic, Life","Janelle Monáe Dance Crazy, Classic, Life",4.02543
5096,Blue Dream,Jhene Aiko Dance Blue Dream,4.5687999999999995
5097,Cliffs Edge,Hayley Kiyoko Dance Cliffs Edge,3.3758639999999995
5098,Booty,Jennifer Lopez Dance Booty,4.188901
5099,Pound The Alarm,Nicki Minaj Dance Pound The Alarm,3.80030426
5100,Bruises (feat. Ashley Monroe),Train Dance Bruises (feat. Ashley Monroe),3.56300683
5101,One In A Million,Ne-Yo Dance One In A Million,4.29740286
5102,Moves (feat. Snoop Dogg),Olly Murs Dance Moves (feat. Snoop Dogg),6.599
5103,I Believe in Us,LÉON Dance I Believe in Us,4.057
5104,Call Me Sir,Train Dance Call Me Sir,4.4341
5105,Lonely Together - (feat. Rita Ora) Alan Walker Remix,Avicii Dance Lonely Together - (feat. Rita Ora) Alan Walker Remix,4.011500000000001
5106,You're Not Alone (feat. Kiiara),Don Diablo Dance You're Not Alone (feat. Kiiara),5.029870000000001
5107,Million Dollar Bills,Lorde Dance Million Dollar Bills,4.486800000000001
5108,Pray to God,Calvin Harris Dance Pray to God,5.032427599999999
5109,Wrist,Chris Brown Dance Wrist,4.914999999999999
5110,White Noise (R3hab Remix),Ella Vos Dance White Noise (R3hab Remix),3.0059290000000005
5111,Afterlife,XYLØ Dance Afterlife,4.02607
5112,Spark (feat. Jacquees),Trey Songz Dance Spark (feat. Jacquees),5.055199999999999
5113,Giving Me Life,Mariah Carey Dance Giving Me Life,3.5063999999999997
5114,Deja Vu (feat. Jay-Z),Beyoncé Dance Deja Vu (feat. Jay-Z),3.7344122
5115,Breathless,The Corrs Dance Breathless,4.446867999999999
5116,Send It (feat. Rich Homie Quan),Austin Mahone Dance Send It (feat. Rich Homie Quan),4.3665
5117,I'm Alive,Céline Dion Dance I'm Alive,3.70710524
5118,Somebody Special,Nina Nesbitt Dance Somebody Special,5.261400000000001
5119,Something New,Zendaya Dance Something New,4.414300000000001
5120,Damaged,Danity Kane Dance Damaged,5.0912
5121,Dusk Till Dawn - Luca Lush Remix,ZAYN Dance Dusk Till Dawn - Luca Lush Remix,3.7706011
5122,It's All in Vain,Wet Dance It's All in Vain,3.5540684999999996
5123,Anthem (We Love House Music),Don Diablo Dance Anthem (We Love House Music),5.8748000000000005
5124,Run Up,Major Lazer Dance Run Up,4.943102120000001
5125,Open Wide,Calvin Harris Dance Open Wide,4.8161000000000005
5126,Even When The Water's Cold,!!! Dance Even When The Water's Cold,5.272379999999999
5127,"Love in This Club, Pt. II","Usher Dance Love in This Club, Pt. II",3.6412
5128,Who Can It Be Now?,Men At Work Dance Who Can It Be Now?,4.446658000000001
5129,Trap (feat. Maluma),Shakira Dance Trap (feat. Maluma),5.163200000000001
5130,Daddy Lessons,Beyoncé Dance Daddy Lessons,4.4962145
5131,Toxic - The Voice Performance,Melanie Martinez Dance Toxic - The Voice Performance,4.4097
5132,Boomerang,Why Don't We Dance Boomerang,3.9800899999999992
5133,Body Language,Jesse McCartney Dance Body Language,3.9045999999999994
5134,Las Cosas Pequeñas,Prince Royce Dance Las Cosas Pequeñas,4.2238999999999995
5135,If You Leave,Orchestral Manoeuvres In The Dark Dance If You Leave,4.0324
5136,Mad World,Tears For Fears Dance Mad World,4.5577000000000005
5137,Don't Let Go (Love),En Vogue Dance Don't Let Go (Love),5.14870632
5138,O Holy Night,Mariah Carey Dance O Holy Night,3.4287064600000003
5139,Be Somebody (feat. Kiiara),Steve Aoki Dance Be Somebody (feat. Kiiara),3.8467718800000004
5140,Scripted,ZAYN Dance Scripted,4.774730000000001
5141,Hold Me Now,Thompson Twins Dance Hold Me Now,4.4252107
5142,You Wish You Knew,ZAYN Dance You Wish You Knew,5.256874000000001
5143,Made In The USA,Demi Lovato Dance Made In The USA,3.847275
5144,When You're Mad,Ne-Yo Dance When You're Mad,3.5809999999999995
5145,Back to Life - 80s Remix,Hailee Steinfeld Dance Back to Life - 80s Remix,3.5120184
5146,La Isla Bonita,Madonna Dance La Isla Bonita,5.85530133
5147,Walking in the Wind,One Direction Dance Walking in the Wind,3.3613
5148,Start It Over (feat. CVBZ & Shy Martin),NOTD Dance Start It Over (feat. CVBZ & Shy Martin),4.2474
5149,Back from the Edge,James Arthur Dance Back from the Edge,4.3979
5150,Emoji,Galantis Dance Emoji,3.651608779999999
5151,Old Bone - Jim-E Stack Remix,Wet Dance Old Bone - Jim-E Stack Remix,3.9684
5152,Have You Ever,Brandy Dance Have You Ever,4.2337
5153,Faded,Conor Maynard Dance Faded,3.4576000000000007
5154,No Goodbyes,Dua Lipa Dance No Goodbyes,3.63045
5155,Make This Song Cry,K. Michelle Dance Make This Song Cry,4.4616
5156,Lindo Pero Bruto,Thalía Dance Lindo Pero Bruto,6.131
5157,Uncover,Zara Larsson Dance Uncover,3.8789999999999996
5158,Walk Like an Egyptian,The Bangles Dance Walk Like an Egyptian,4.4819866
5159,Home,One Direction Dance Home,3.4765
5160,La Calle De Las Sirenas,Kabah Dance La Calle De Las Sirenas,4.3623899999999995
5161,Never Enough,Kelly Clarkson Dance Never Enough,3.0442
5162,Fences,Vicetone Dance Fences,5.621699999999999
5163,Velvet Rope,Rita Ora Dance Velvet Rope,4.0135
5164,I'm a Mess - Acoustic,Bebe Rexha Dance I'm a Mess - Acoustic,4.47600361
5165,Keep Me Up,Charlotte Lawrence Dance Keep Me Up,5.3365
5166,Fotografía,Juanes Dance Fotografía,4.310300000000001
5167,Particula,Major Lazer Dance Particula,3.4903218999999996
5168,Yernin,Sevyn Streeter Dance Yernin,4.6976
5169,Broken Home,5 Seconds of Summer Dance Broken Home,4.548399999999999
5170,Chasing Highs,ALMA Dance Chasing Highs,5.763215500000001
5171,Body on Me,Rita Ora Dance Body on Me,4.9322
5172,That Girl,Olly Murs Dance That Girl,5.5591
5173,Before I Let You Go,Blackstreet Dance Before I Let You Go,4.6574
5174,Nobody Compares,One Direction Dance Nobody Compares,4.03799
5175,DADDY,PSY Dance DADDY,5.564800000000001
5176,Lifestyle,NEIKED Dance Lifestyle,3.5577
5177,All That,ZAYN Dance All That,3.3183489999999995
5178,Cyclone (feat. T-Pain) - Main,Baby Bash Dance Cyclone (feat. T-Pain) - Main,3.4562999999999997
5179,Beach House - Ashworth Remix,The Chainsmokers Dance Beach House - Ashworth Remix,3.5867039599999995
5180,Dose,Ciara Dance Dose,5.327925
5181,The Lost Boy (feat. Skizzy Mars),Lostboycrow Dance The Lost Boy (feat. Skizzy Mars),3.8911999999999995
5182,Beneath The Streetlights And The Moon,JP Cooper Dance Beneath The Streetlights And The Moon,2.7724
5183,Lay Yo Head,Trey Songz Dance Lay Yo Head,3.6517
5184,Through the Dark,One Direction Dance Through the Dark,3.6037
5185,We Takin' Over,DJ Khaled Dance We Takin' Over,5.545100000000001
5186,lovers’ carvings,Bibio Dance lovers’ carvings,5.2356
5187,Manic Monday,The Bangles Dance Manic Monday,4.15690369
5188,Cana (feat. 24hrs),Kid Ink Dance Cana (feat. 24hrs),5.0177
5189,Version Of Me,Sasha Sloan Dance Version Of Me,3.3465
5190,Yoga,Janelle Monáe Dance Yoga,4.423784100000001
5191,If It Ain't Love,Jason Derulo Dance If It Ain't Love,5.636699999999999
5192,Bailar,Deorro Dance Bailar,4.25480648
5193,"Ciega, Sordomuda","Shakira Dance Ciega, Sordomuda",4.70130251
5194,Ruin The Friendship,Demi Lovato Dance Ruin The Friendship,4.5850501
5195,Juicy Booty,Chris Brown Dance Juicy Booty,4.678399999999999
5196,Talking In Your Sleep,The Romantics Dance Talking In Your Sleep,5.670545000000001
5197,Watch Out For This (Bumaye),Major Lazer Dance Watch Out For This (Bumaye),5.35490653
5198,Bigger Wow,Avril Lavigne Dance Bigger Wow,4.0855999999999995
5199,Damaged Goods,Gang Of Four Dance Damaged Goods,4.4345
5200,Rock DJ,Robbie Williams Dance Rock DJ,3.9656999999999996
5201,The Rhythm of the Night,Corona Dance The Rhythm of the Night,6.126831999999999
5202,TREAT MYSELF,Meghan Trainor Dance TREAT MYSELF,4.3231399999999995
5203,Can't Leave 'Em Alone,Ciara Dance Can't Leave 'Em Alone,4.7726
5204,BoRdErSz,ZAYN Dance BoRdErSz,3.3402999999999996
5205,Exits,Foals Dance Exits,5.948569999999999
5206,Turn It Off,Why Don't We Dance Turn It Off,3.3184
5207,All Into Nothing,R3HAB Dance All Into Nothing,3.7002
5208,So Emotional,Whitney Houston Dance So Emotional,5.354651700000001
5209,Money and the Power,Kid Ink Dance Money and the Power,3.7330769
5210,Borderline - Vanic Remix,Tove Styrke Dance Borderline - Vanic Remix,4.9043552
5211,I Love You,Axwell /\ Ingrosso Dance I Love You,4.577999999999999
5212,Way Down,MØ Dance Way Down,4.944059
5213,Sway,Tove Styrke Dance Sway,4.210223
5214,Colors pt. II,Halsey Dance Colors pt. II,3.6655999999999995
5215,Fine Mess,Interpol Dance Fine Mess,4.75058
5216,Get It Shawty - Main,Lloyd Dance Get It Shawty - Main,5.4548
5217,Rio - 2009 Remastered Version,Duran Duran Dance Rio - 2009 Remastered Version,4.0565182
5218,Sadness,Noah Cyrus Dance Sadness,4.1073
5219,Give It Up,Victorious Cast Dance Give It Up,5.45550649
5220,Scared of Love (feat. RAY BLK & Stefflon Don),Rudimental Dance Scared of Love (feat. RAY BLK & Stefflon Don),4.182501869999999
5221,Living Years,Mike & The Mechanics Dance Living Years,3.1927000000000003
5222,Let It Be,Hayley Kiyoko Dance Let It Be,3.74460413
5223,Just A Fool,Christina Aguilera Dance Just A Fool,3.5579
5224,Back To Sleep REMIX,Chris Brown Dance Back To Sleep REMIX,5.335999999999999
5225,Dance Off (feat. Idris Elba & Anderson .Paak),Macklemore & Ryan Lewis Dance Dance Off (feat. Idris Elba & Anderson .Paak),3.882527
5226,Waste It On Me - Slushii Remix,Steve Aoki Dance Waste It On Me - Slushii Remix,4.0029
5227,Zero,Chris Brown Dance Zero,5.1038
5228,No Mediocre,T.I. Dance No Mediocre,3.044
5229,Show Me,Bruno Mars Dance Show Me,3.5496
5230,Heaven Knows I'm Miserable Now - 2011 Remaster,The Smiths Dance Heaven Knows I'm Miserable Now - 2011 Remaster,4.0256
5231,Wildflowers - Recorded at Spotify Studios NYC,Miley Cyrus Dance Wildflowers - Recorded at Spotify Studios NYC,3.6304
5232,All Around The World,Justin Bieber Dance All Around The World,5.51200242
5233,Wild Thoughts - Medasin Dance Remix,DJ Khaled Dance Wild Thoughts - Medasin Dance Remix,4.0477
5234,All I Have,Jennifer Lopez Dance All I Have,3.706
5235,I'm Stuck,Noah Cyrus Dance I'm Stuck,3.7721400000000003
5236,"Kitty Girl (feat. The Cast of Rupaul's Drag Race All Stars, Season 3)","RuPaul Dance Kitty Girl (feat. The Cast of Rupaul's Drag Race All Stars, Season 3)",4.33908
5237,Self Control,Laura Branigan Dance Self Control,5.51206
5238,Promise,Ciara Dance Promise,3.7834038
5239,April Gloom,Jack & Jack Dance April Gloom,4.723
5240,Oops,Little Mix Dance Oops,5.835300000000001
5241,Shots & Squats,Vigiland Dance Shots & Squats,4.358162999999999
5242,Numb - Bonus Track,August Alsina Dance Numb - Bonus Track,4.1698
5243,dRuNk,ZAYN Dance dRuNk,3.8000099
5244,El Amor Que Perdimos,Prince Royce Dance El Amor Que Perdimos,4.2325144
5245,What Went Down,Foals Dance What Went Down,4.373749999999999
5246,Take Back the Night,Justin Timberlake Dance Take Back the Night,3.895043
5247,Hola (feat. Maluma),Flo Rida Dance Hola (feat. Maluma),4.155630400000001
5248,Neon Sky,Feenixpawl Dance Neon Sky,4.16960147
5249,I Wanna Go,Britney Spears Dance I Wanna Go,4.187193799999999
5250,I Bet,Ciara Dance I Bet,3.5478000000000005
5251,I Gotta Be,Jagged Edge Dance I Gotta Be,3.7836000000000003
5252,Love Me Insane,Avril Lavigne Dance Love Me Insane,4.091
5253,Sober II (Melodrama),Lorde Dance Sober II (Melodrama),3.44740479
5254,Jealous,Beyoncé Dance Jealous,3.217339999999999
5255,Who's Gonna (NOBODY),Chris Brown Dance Who's Gonna (NOBODY),4.175000000000001
5256,Neighborhood #1 (Tunnels),Arcade Fire Dance Neighborhood #1 (Tunnels),3.2933
5257,Ain't No Other Man,Christina Aguilera Dance Ain't No Other Man,4.18731
5258,Greyhound,Swedish House Mafia Dance Greyhound,5.30376
5259,For Now,P!nk Dance For Now,3.7981
5260,Baby Boy (feat. Beyoncé ),Sean Paul Dance Baby Boy (feat. Beyoncé ),3.9667024599999996
5261,Told You So,Miguel Dance Told You So,3.8095000000000003
5262,"The Island, Pt. 1 (Dawn) - Skrillex Remix","Pendulum Dance The Island, Pt. 1 (Dawn) - Skrillex Remix",4.861420000000001
5263,Brass in Pocket - 2006 Remaster,Pretenders Dance Brass in Pocket - 2006 Remaster,4.379930000000001
5264,If I Had You,Adam Lambert Dance If I Had You,5.377300000000001
5265,Perfect,Why Don't We Dance Perfect,5.84
5266,데리러 가 Good Evening,SHINee Dance 데리러 가 Good Evening,4.0431
5267,"C'mon, C'mon","One Direction Dance C'mon, C'mon",5.4436
5268,Heartbreaker,Pat Benatar Dance Heartbreaker,4.955709939999999
5269,Dem Beats,Todrick Hall Dance Dem Beats,4.115331299999999
5270,These Words,Natasha Bedingfield Dance These Words,4.2236
5271,Pullin' Me Back,Chingy Dance Pullin' Me Back,3.8045000000000004
5272,Tip Pon It,Sean Paul Dance Tip Pon It,5.64978
5273,Moneda (feat. Gerardo Ortiz),Prince Royce Dance Moneda (feat. Gerardo Ortiz),4.4709330000000005
5274,Laid,James Dance Laid,4.056631
5275,If It Isn't Love,New Edition Dance If It Isn't Love,4.9495135999999995
5276,Gateway Drug,Bebe Rexha Dance Gateway Drug,4.9852
5277,(You Drive Me) Crazy,Britney Spears Dance (You Drive Me) Crazy,5.6465
5278,Bedroom,The-Dream Dance Bedroom,5.275851
5279,Hot2Touch,Felix Jaehn Dance Hot2Touch,5.6339718
5280,I Knew You Were Waiting (For Me),George Michael Dance I Knew You Were Waiting (For Me),4.289499999999999
5281,I Like Me Better - Ryan Riback Remix,Lauv Dance I Like Me Better - Ryan Riback Remix,2.8885022999999994
5282,Is Your Love Enough?,Little Mix Dance Is Your Love Enough?,5.3792211100000005
5283,My Girls,Animal Collective Dance My Girls,5.9300999999999995
5284,Blue (Da Ba Dee) - Gabry Ponte Video Edit,Eiffel 65 Dance Blue (Da Ba Dee) - Gabry Ponte Video Edit,5.708831000000001
5285,Birch Tree,Foals Dance Birch Tree,4.8382000000000005
5286,E.I.,Nelly Dance E.I.,4.343100000000001
5287,Secrets - Radio Edit,Tiësto Dance Secrets - Radio Edit,4.7714099999999995
5288,House On Fire,Sia Dance House On Fire,4.665425
5289,Confessions,Usher Dance Confessions,3.6011
5290,Picture Book - 2018 Stereo Remaster,The Kinks Dance Picture Book - 2018 Stereo Remaster,4.58483
5291,Plot Twist,Sigrid Dance Plot Twist,3.7232300000000005
5292,Eternal Flame,The Bangles Dance Eternal Flame,4.750500000000001
5293,The Things We Do For Love,10cc Dance The Things We Do For Love,3.9374000000000007
5294,Winter Wars,Wale Dance Winter Wars,4.922999999999999
5295,Torn - Bonus Track,James TW Dance Torn - Bonus Track,3.813
5296,I Want It All - Original Version,High School Musical Cast Dance I Want It All - Original Version,4.5439
5297,When We Love,Jhene Aiko Dance When We Love,4.8552
5298,Acapella,Karmin Dance Acapella,3.8019999999999996
5299,Straight to Hell,The Clash Dance Straight to Hell,3.5418114
5300,Running Out,Matoma Dance Running Out,3.26624
5301,Be Together,Major Lazer Dance Be Together,4.183319999999999
5302,Lost in the Supermarket,The Clash Dance Lost in the Supermarket,3.93098
5303,WTF (Where They From) [feat. Pharrell Williams],Missy Elliott Dance WTF (Where They From) [feat. Pharrell Williams],5.1878068100000005
5304,Right Here - Human Nature Radio Mix,SWV Dance Right Here - Human Nature Radio Mix,4.7542
5305,Long Way Down,One Direction Dance Long Way Down,3.7064231
5306,Ganas Locas (feat. Farruko),Prince Royce Dance Ganas Locas (feat. Farruko),5.3574
5307,What the Hell,Avril Lavigne Dance What the Hell,5.37522
5308,Money Make Her Smile,Bruno Mars Dance Money Make Her Smile,3.8302739000000003
5309,After All (Love Theme From Chances Are),Cher Dance After All (Love Theme From Chances Are),3.2468
5310,"I Feel Love - 12"" Version","Donna Summer Dance I Feel Love - 12"" Version",5.1074
5311,Last Dance,Dua Lipa Dance Last Dance,4.608
5312,Hangover,Taio Cruz Dance Hangover,4.2901
5313,Save The World,Swedish House Mafia Dance Save The World,3.6337
5314,No Scrubs,William Singe Dance No Scrubs,4.854
5315,Dance Again,Jennifer Lopez Dance Dance Again,5.36300288
5316,All For Love,Tungevaag & Raaban Dance All For Love,5.263810299999999
5317,Goes Like That,Mario Dance Goes Like That,3.8947000000000003
5318,Wild Heart,SoMo Dance Wild Heart,4.8264
5319,"Sledgehammer - From The Motion Picture ""Star Trek Beyond""","Rihanna Dance Sledgehammer - From The Motion Picture ""Star Trek Beyond""",4.288
5320,L'amour Toujours (Small Mix),Gigi D'Agostino Dance L'amour Toujours (Small Mix),4.8824
5321,Criminal,Britney Spears Dance Criminal,4.1472999999999995
5322,Young Liars,TV On The Radio Dance Young Liars,3.1220399999999997
5323,Team,Iggy Azalea Dance Team,4.1818
5324,Tokyo,White Lies Dance Tokyo,4.2976
5325,Mirrors,Niall Horan Dance Mirrors,3.4149
5326,Currency,Ivy Adara Dance Currency,3.1384023999999995
5327,Hitchhiker,Demi Lovato Dance Hitchhiker,3.744012099999999
5328,Dreamlover,Mariah Carey Dance Dreamlover,3.7996999999999996
5329,Been You,Justin Bieber Dance Been You,5.3615
5330,Go On Girl,Ne-Yo Dance Go On Girl,4.0827
5331,Anniversary,Tony! Toni! Toné! Dance Anniversary,4.4205
5332,Diamonds Are Forever,Sabrina Carpenter Dance Diamonds Are Forever,4.286370000000001
5333,I'm Every Woman,Chaka Khan Dance I'm Every Woman,5.212718
5334,You Don’t Get Me High Anymore,Phantogram Dance You Don’t Get Me High Anymore,4.122389999999999
5335,Little L,Jamiroquai Dance Little L,5.864599999999999
5336,So Anxious,Ginuwine Dance So Anxious,4.86160237
5337,Promise Me,Jack & Jack Dance Promise Me,3.4061999999999997
5338,Sunset Jesus,Avicii Dance Sunset Jesus,3.9674010600000007
5339,Through It All,Charlie Puth Dance Through It All,3.5351000000000004
5340,Angel Down - Work Tape,Lady Gaga Dance Angel Down - Work Tape,3.0084000000000004
5341,Vapor,5 Seconds of Summer Dance Vapor,3.7451
5342,Tru,Lloyd Dance Tru,2.9341000000000004
5343,Only One - Brookes Brothers Remix,Sigala Dance Only One - Brookes Brothers Remix,4.2439860000000005
5344,Reflection,Trey Songz Dance Reflection,4.6760217
5345,Jump (For My Love),The Pointer Sisters Dance Jump (For My Love),5.5144088700000005
5346,Til I Get Found,Marc E. Bassy Dance Til I Get Found,4.649
5347,Never Catch Me,Flying Lotus Dance Never Catch Me,3.9803840000000004
5348,The Shoop Shoop Song (It's In His Kiss),Cher Dance The Shoop Shoop Song (It's In His Kiss),4.554600000000001
5349,Pony,William Singe Dance Pony,4.6024
5350,Crazy for You,Madonna Dance Crazy for You,3.5468
5351,Yes,LMFAO Dance Yes,5.4313
5352,More - RedOne Jimmy Joker Remix,Usher Dance More - RedOne Jimmy Joker Remix,4.446960000000001
5353,Too Shy,Kajagoogoo Dance Too Shy,4.7859938
5354,Thought I Knew You (feat. The Weeknd),Nicki Minaj Dance Thought I Knew You (feat. The Weeknd),3.84782
5355,Another Night,Real McCoy Dance Another Night,4.4225699999999994
5356,Any Kind of Guy,Big Time Rush Dance Any Kind of Guy,4.8969000000000005
5357,Don't Leave Me Alone (feat. Anne-Marie) - Oliver Heldens Remix,David Guetta Dance Don't Leave Me Alone (feat. Anne-Marie) - Oliver Heldens Remix,4.7081556
5358,Venus Fly,Grimes Dance Venus Fly,5.343585
5359,Bounce (feat. Kelis) - Radio Edit,Calvin Harris Dance Bounce (feat. Kelis) - Radio Edit,6.6123
5360,100 Years,Florence + The Machine Dance 100 Years,3.60990687
5361,Bad Girlfriend,Anne-Marie Dance Bad Girlfriend,4.448499999999999
5362,Lock It Up (feat. Kehlani),Marc E. Bassy Dance Lock It Up (feat. Kehlani),5.0817000000000005
5363,Asleep - 2011 Remaster,The Smiths Dance Asleep - 2011 Remaster,4.0371
5364,Rechazame,Prince Royce Dance Rechazame,4.28360702
5365,High Without Your Love,Loote Dance High Without Your Love,3.8632000000000004
5366,Cool,Alesso Dance Cool,5.2478
5367,Bailando por Ahi,Juan Magán Dance Bailando por Ahi,5.62870222
5368,City Of Dreams - Radio Edit,Dirty South Dance City Of Dreams - Radio Edit,3.56363
5369,Get Free,Major Lazer Dance Get Free,4.7644
5370,Volví a Nacer,Carlos Vives Dance Volví a Nacer,3.843
5371,Bridges,Broods Dance Bridges,4.2935
5372,Better Life,P!nk Dance Better Life,3.5332
5373,Miss You So Much,Miley Cyrus Dance Miss You So Much,3.01010712
5374,Tiny Dancer,Florence + The Machine Dance Tiny Dancer,3.3851085
5375,Magic Stick,Lil' Kim Dance Magic Stick,3.9350496999999995
5376,Por Favor - Spanglish Version,Fifth Harmony Dance Por Favor - Spanglish Version,4.1933020999999995
5377,Do Me Wrong,Kid Ink Dance Do Me Wrong,5.2194561
5378,Tie Me Down (feat. Elley Duhé) - L'Tric Remix,Gryffin Dance Tie Me Down (feat. Elley Duhé) - L'Tric Remix,3.6654669999999996
5379,I Ran (So Far Away),A Flock Of Seagulls Dance I Ran (So Far Away),4.12729
5380,Beauty,Dru Hill Dance Beauty,4.6025
5381,That's What I Like - PARTYNEXTDOOR Remix,Bruno Mars Dance That's What I Like - PARTYNEXTDOOR Remix,4.1015999999999995
5382,I Like Me Better - Cheat Codes Remix,Lauv Dance I Like Me Better - Cheat Codes Remix,4.03423
5383,Chasing Fire - Robin Schulz Remix,Lauv Dance Chasing Fire - Robin Schulz Remix,3.67342
5384,1x1,Trey Songz Dance 1x1,4.4357
5385,Rain,SWV Dance Rain,4.79880386
5386,The Wave,R3HAB Dance The Wave,3.0463
5387,Ganja Burn,Nicki Minaj Dance Ganja Burn,5.50219
5388,Take Me To The River - 2005 Remastered Version,Talking Heads Dance Take Me To The River - 2005 Remastered Version,3.7275
5389,Show Love,Kiana Ledé Dance Show Love,5.1209999999999996
5390,Hold On,En Vogue Dance Hold On,3.3979999999999997
5391,Como Yo Le Doy - Spanglish Version,Pitbull Dance Como Yo Le Doy - Spanglish Version,4.64100124
5392,Don't Let Me Down - W&W Remix,The Chainsmokers Dance Don't Let Me Down - W&W Remix,4.89928
5393,What Would I Change It To (feat. AlunaGeorge),Avicii Dance What Would I Change It To (feat. AlunaGeorge),3.95030624
5394,Little White Lies,One Direction Dance Little White Lies,4.04986
5395,shedontknowbutsheknows,Tove Lo Dance shedontknowbutsheknows,5.178
5396,Will Do,TV On The Radio Dance Will Do,3.3819000000000004
5397,Love Shack - Edit,The B-52's Dance Love Shack - Edit,6.13990128
5398,Va Va Voom,Nicki Minaj Dance Va Va Voom,4.215109999999999
5399,Strangers,The Kinks Dance Strangers,3.4055135000000005
5400,Better Than Words,One Direction Dance Better Than Words,5.727799999999999
5401,Game Time (feat. Sage The Gemini),Flo Rida Dance Game Time (feat. Sage The Gemini),3.59158
5402,Dirty Computer (feat. Brian Wilson),Janelle Monáe Dance Dirty Computer (feat. Brian Wilson),3.8289338
5403,Whole Lotta Woman,Kelly Clarkson Dance Whole Lotta Woman,5.1889
5404,I Need Your Love,Shaggy Dance I Need Your Love,3.9700000000000006
5405,On Your Side,The Veronicas Dance On Your Side,4.6517
5406,About You,Trey Songz Dance About You,5.2656
5407,Le Pido Al Cielo,Luis Fonsi Dance Le Pido Al Cielo,3.8811
5408,ARTPOP,Lady Gaga Dance ARTPOP,3.5305718999999995
5409,Song Cry,August Alsina Dance Song Cry,4.35320236
5410,Cuando Nos Volvamos a Encontrar (feat. Marc Anthony),Carlos Vives Dance Cuando Nos Volvamos a Encontrar (feat. Marc Anthony),4.1372
5411,King Of My Castle - Don Diablo Edit,Don Diablo Dance King Of My Castle - Don Diablo Edit,5.1430726
5412,Never Be the Same - Radio Edit,Camila Cabello Dance Never Be the Same - Radio Edit,3.5837020000000006
5413,Been Around the World (feat. The Notorious B.I.G. & Mase),Diddy Dance Been Around the World (feat. The Notorious B.I.G. & Mase),5.2101
5414,4 Walls,f(x) Dance 4 Walls,4.8348294
5415,What About Us - Cash Cash Remix,P!nk Dance What About Us - Cash Cash Remix,3.6635049200000003
5416,Don't Leave Me Alone (feat. Anne-Marie) - Acoustic,David Guetta Dance Don't Leave Me Alone (feat. Anne-Marie) - Acoustic,4.611100000000001
5417,Boomin' In Your Jeep,Crystal Fighters Dance Boomin' In Your Jeep,3.807278
5418,Waving Through A Window - from Dear Evan Hansen,Katy Perry Dance Waving Through A Window - from Dear Evan Hansen,4.0159
5419,Personal,The Vamps Dance Personal,3.7786000000000004
5420,8th Grade,Mariah Carey Dance 8th Grade,3.2223
5421,Sledgehammer - 2012 Remaster,Peter Gabriel Dance Sledgehammer - 2012 Remaster,3.2558
5422,Spaces,One Direction Dance Spaces,3.5085
5423,If I'm Lucky,Jason Derulo Dance If I'm Lucky,5.09673
5424,Autumn Leaves,Chris Brown Dance Autumn Leaves,3.656
5425,3,Britney Spears Dance 3,5.2486999999999995
5426,Hair,Little Mix Dance Hair,4.9995141
5427,Rainbow (From The Original Motion Picture Soundtrack 'My Little Pony: The Movie'),Sia Dance Rainbow (From The Original Motion Picture Soundtrack 'My Little Pony: The Movie'),3.6901
5428,Change My Mind,One Direction Dance Change My Mind,3.4707999999999997
5429,You're the Best,Wet Dance You're the Best,2.45684
5430,Voices Carry - Single Mix,'Til Tuesday Dance Voices Carry - Single Mix,3.12909445
5431,Ten Feet Tall,Afrojack Dance Ten Feet Tall,3.914
5432,Some Type Of Love,Charlie Puth Dance Some Type Of Love,3.654
5433,Wild Wild West - Album Version With Intro,Will Smith Dance Wild Wild West - Album Version With Intro,4.9982999999999995
5434,LoveStoned / I Think She Knows Interlude,Justin Timberlake Dance LoveStoned / I Think She Knows Interlude,5.685616
5435,5 In The Morning,Charli XCX Dance 5 In The Morning,3.5114
5436,Clouds,One Direction Dance Clouds,3.6929
5437,24/Seven,Big Time Rush Dance 24/Seven,4.63104
5438,Fade Into Darkness - Vocal Radio Mix,Avicii Dance Fade Into Darkness - Vocal Radio Mix,4.58725128
5439,Beautiful Life,Ace of Base Dance Beautiful Life,5.660010000000001
5440,Sing To Me,Jhene Aiko Dance Sing To Me,4.57000791
5441,Stay With You,Cheat Codes Dance Stay With You,4.47450169
5442,Hard,Rihanna Dance Hard,3.8371
