,track_name,textual,numerical
2517,Every Breath You Take - Remastered 2003,The Police Dance Every Breath You Take - Remastered 2003,4.8935
2518,I Kissed A Girl,Katy Perry Dance I Kissed A Girl,4.42093
2519,Too Deep,Kehlani Dance Too Deep,5.974600000000001
2520,Diggin' My Grave,Lady Gaga Dance Diggin' My Grave,5.3057153
2521,Done for Me (feat. Kehlani),Charlie Puth Dance Done for Me (feat. Kehlani),5.8388
2522,REMEDY,Alesso Dance REMEDY,4.9296
2523,Chun-Li,Nicki Minaj Dance Chun-Li,6.0380508
2524,Truth Hurts,Lizzo Dance Truth Hurts,5.405
2525,Before He Cheats,Carrie Underwood Dance Before He Cheats,5.3885000000000005
2526,Run the World (Girls),Beyoncé Dance Run the World (Girls),5.3410072
2527,"Back to Life - from ""Bumblebee""","Hailee Steinfeld Dance Back to Life - from ""Bumblebee""",5.1034
2528,Impatient,Jeremih Dance Impatient,5.0728
2529,Dead,Madison Beer Dance Dead,5.788
2530,Say Something,Justin Timberlake Dance Say Something,3.7070109
2531,My Love (feat. T.I.),Justin Timberlake Dance My Love (feat. T.I.),6.641011700000001
2532,Velvet Elvis,Kacey Musgraves Dance Velvet Elvis,4.0547
2533,How Far I'll Go - Alessia Cara Version,Alessia Cara Dance How Far I'll Go - Alessia Cara Version,3.9708440000000005
2534,Without Me - ILLENIUM Remix,Halsey Dance Without Me - ILLENIUM Remix,4.84090222
2535,All I Want for Christmas Is You,Mariah Carey Dance All I Want for Christmas Is You,4.064400000000001
2536,Holy,King Princess Dance Holy,3.9809289999999997
2537,No Diggity,Blackstreet Dance No Diggity,6.407
2538,Apologize,OneRepublic Dance Apologize,4.357918
2539,Generation Why,Conan Gray Dance Generation Why,4.11090293
2540,Avril 14th,Aphex Twin Dance Avril 14th,4.701600000000001
2541,Just Got Paid,Sigala Dance Just Got Paid,6.1803
2542,Super Bass,Nicki Minaj Dance Super Bass,5.50000511
2543,Malibu,Miley Cyrus Dance Malibu,4.4925264
2544,Symphony (feat. Zara Larsson),Clean Bandit Dance Symphony (feat. Zara Larsson),5.8533159999999995
2545,Side Effects,The Chainsmokers Dance Side Effects,4.6991700000000005
2546,Back To You,Selena Gomez Dance Back To You,4.26070126
2547,Crank That (Soulja Boy),Soulja Boy Dance Crank That (Soulja Boy),5.509099999999999
2548,Heal Me,Lady Gaga Dance Heal Me,4.7459999999999996
2549,Don’t Blame Me,Taylor Swift Dance Don’t Blame Me,4.7383176
2550,Your Shirt,Chelsea Cutler Dance Your Shirt,4.0431
2551,Summertime Sadness (Lana Del Rey Vs. Cedric Gervais) - Cedric Gervais Remix / Radio Edit,Lana Del Rey Dance Summertime Sadness (Lana Del Rey Vs. Cedric Gervais) - Cedric Gervais Remix / Radio Edit,4.961608719999999
2552,You're Such A,Hailee Steinfeld Dance You're Such A,4.602681
2553,Entertainer,ZAYN Dance Entertainer,4.8361244
2554,Right Now (Na Na Na),Akon Dance Right Now (Na Na Na),6.334
2555,Swalla (feat. Nicki Minaj & Ty Dolla $ign),Jason Derulo Dance Swalla (feat. Nicki Minaj & Ty Dolla $ign),5.11
2556,Irreplaceable,Beyoncé Dance Irreplaceable,5.86330546
2557,Always Be My Baby,Mariah Carey Dance Always Be My Baby,4.2683
2558,What Do You Mean?,Justin Bieber Dance What Do You Mean?,6.388998
2559,Fetish (feat. Gucci Mane),Selena Gomez Dance Fetish (feat. Gucci Mane),4.024803589999999
2560,Timber,Pitbull Dance Timber,4.9776
2561,Best Mistake,Ariana Grande Dance Best Mistake,4.8469999999999995
2562,Escápate Conmigo (feat. Ozuna),Wisin Dance Escápate Conmigo (feat. Ozuna),4.9782627
2563,You & Me,James TW Dance You & Me,5.07630773
2564,Wild Thoughts (feat. Rihanna & Bryson Tiller),DJ Khaled Dance Wild Thoughts (feat. Rihanna & Bryson Tiller),4.1415
2565,Bleeding Love,Leona Lewis Dance Bleeding Love,4.3507
2566,Feel Good (feat. Daya),Gryffin Dance Feel Good (feat. Daya),4.5357
2567,Chi Chi (feat. Chris Brown),Trey Songz Dance Chi Chi (feat. Chris Brown),5.5167
2568,It Will Rain,Bruno Mars Dance It Will Rain,4.5079
2569,Hey Brother,Avicii Dance Hey Brother,5.4070612
2570,Born This Way,Lady Gaga Dance Born This Way,4.35827
2571,Slow Motion,Trey Songz Dance Slow Motion,5.262839200000001
2572,The Lazy Song,Bruno Mars Dance The Lazy Song,5.5581000000000005
2573,1999,Charli XCX Dance 1999,5.11260139
2574,My My My!,Troye Sivan Dance My My My!,3.9198209999999998
2575,Whatever You Like,T.I. Dance Whatever You Like,5.656
2576,Love Is A Wild Thing,Kacey Musgraves Dance Love Is A Wild Thing,3.8973072
2577,Drunk in Love,Beyoncé Dance Drunk in Love,5.2585299999999995
2578,Hide Away,Daya Dance Hide Away,5.29350165
2579,Jessie's Girl,Rick Springfield Dance Jessie's Girl,4.811999999999999
2580,"Sit Still, Look Pretty","Daya Dance Sit Still, Look Pretty",4.9670000000000005
2581,Happy,Pharrell Williams Dance Happy,5.3995999999999995
2582,Gorgeous,Taylor Swift Dance Gorgeous,4.1843094800000005
2583,All These Years,Camila Cabello Dance All These Years,5.5569999999999995
2584,Morning Glory,Kehlani Dance Morning Glory,5.6362000000000005
2585,Too Much To Ask,Niall Horan Dance Too Much To Ask,4.3797
2586,Feels Great (feat. Fetty Wap & CVBZ),Cheat Codes Dance Feels Great (feat. Fetty Wap & CVBZ),4.3069
2587,Night Changes,One Direction Dance Night Changes,4.826300000000001
2588,Échame La Culpa,Luis Fonsi Dance Échame La Culpa,4.748200000000001
2589,So What,P!nk Dance So What,4.1923062600000005
2590,Oops!...I Did It Again,Britney Spears Dance Oops!...I Did It Again,6.4287177
2591,A Million Dreams,P!nk Dance A Million Dreams,3.9718
2592,The Nights,Avicii Dance The Nights,4.8159
2593,Wake Me up Before You Go-Go,Wham! Dance Wake Me up Before You Go-Go,4.602799999999999
2594,She Looks So Perfect,5 Seconds of Summer Dance She Looks So Perfect,5.6956679999999995
2595,Bed (feat. Ariana Grande),Nicki Minaj Dance Bed (feat. Ariana Grande),4.4828617
2596,No Place,Backstreet Boys Dance No Place,4.046600000000001
2597,Pon de Replay,Rihanna Dance Pon de Replay,4.363925
2598,Stole Your Car,Charlotte Lawrence Dance Stole Your Car,5.2841304
2599,Flames,David Guetta Dance Flames,5.4332084499999995
2600,Getting Over You,Lauv Dance Getting Over You,3.65650227
2601,Trust Fund Baby,Why Don't We Dance Trust Fund Baby,4.7267
2602,Waiting For Love,Avicii Dance Waiting For Love,6.1067
2603,Head Above Water,Avril Lavigne Dance Head Above Water,4.0858
2604,Want To,Dua Lipa Dance Want To,5.094831999999999
2605,RIP (feat. G-Eazy & Drew Love),Olivia O'Brien Dance RIP (feat. G-Eazy & Drew Love),5.4822
2606,HeadBand (feat. 2 Chainz),B.o.B Dance HeadBand (feat. 2 Chainz),4.170100000000001
2607,"Feels (feat. Pharrell Williams, Katy Perry & Big Sean)","Calvin Harris Dance Feels (feat. Pharrell Williams, Katy Perry & Big Sean)",6.118600000000001
2608,7/11,Beyoncé Dance 7/11,5.6258
2609,Pussy Is God,King Princess Dance Pussy Is God,5.074490000000001
2610,Don't Leave Me Alone (feat. Anne-Marie),David Guetta Dance Don't Leave Me Alone (feat. Anne-Marie),5.6707
2611,Only,Nicki Minaj Dance Only,5.8429
2612,Unwritten,Natasha Bedingfield Dance Unwritten,4.55687
2613,Only Want You,Rita Ora Dance Only Want You,4.9426714
2614,They Don't Know About Us,One Direction Dance They Don't Know About Us,4.3101
2615,Love Language,Kehlani Dance Love Language,5.0904
2616,Wonder Woman,Kacey Musgraves Dance Wonder Woman,3.9365158
2617,Cheerleader - Felix Jaehn Remix Radio Edit,OMI Dance Cheerleader - Felix Jaehn Remix Radio Edit,4.113512
2618,The Way (feat. Chance the Rapper),Kehlani Dance The Way (feat. Chance the Rapper),4.5809999999999995
2619,Rock Bottom,Hailee Steinfeld Dance Rock Bottom,4.7922
2620,Hands To Myself,Selena Gomez Dance Hands To Myself,5.13370244
2621,Bubbly,Colbie Caillat Dance Bubbly,4.218
2622,Loyal,Chris Brown Dance Loyal,4.31360103
2623,Solita (feat. Rich The Kid),PRETTYMUCH Dance Solita (feat. Rich The Kid),4.7059999999999995
2624,This Town,Niall Horan Dance This Town,5.3422
2625,Faith - Remastered,George Michael Dance Faith - Remastered,4.1676358
2626,Don't Matter,Akon Dance Don't Matter,4.0634
2627,Remember (with ZOHARA),Gryffin Dance Remember (with ZOHARA),5.7523
2628,Kream (feat. Tyga),Iggy Azalea Dance Kream (feat. Tyga),4.16850436
2629,U Remind Me,Usher Dance U Remind Me,4.7442
2630,Nervous,Shawn Mendes Dance Nervous,4.742
2631,Why Did You Do That?,Lady Gaga Dance Why Did You Do That?,5.332609939999999
2632,Breathe Me,Sia Dance Breathe Me,4.0858
2633,Pump It,The Black Eyed Peas Dance Pump It,5.4099
2634,Cold Water,Major Lazer Dance Cold Water,5.1434
2635,Last Friday Night (T.G.I.F.),Katy Perry Dance Last Friday Night (T.G.I.F.),6.325793099999999
2636,Chasing Fire,Lauv Dance Chasing Fire,4.285299999999999
2637,True Colors (feat. Maya Avedis),XO Cupid Dance True Colors (feat. Maya Avedis),4.3202
2638,Amnesia,5 Seconds of Summer Dance Amnesia,3.3544
2639,Runaway (U & I),Galantis Dance Runaway (U & I),4.208539999999999
2640,Bad Bitch (feat. Ty Dolla $ign),Bebe Rexha Dance Bad Bitch (feat. Ty Dolla $ign),4.1032
2641,Airplanes (feat. Hayley Williams),B.o.B Dance Airplanes (feat. Hayley Williams),5.275799999999999
2642,Back to You (feat. Bebe Rexha & Digital Farm Animals),Louis Tomlinson Dance Back to You (feat. Bebe Rexha & Digital Farm Animals),5.695
2643,Tonight Tonight,Hot Chelle Rae Dance Tonight Tonight,4.7863999999999995
2644,Make Me (Cry),Noah Cyrus Dance Make Me (Cry),4.26946
2645,We Found Love,Rihanna Dance We Found Love,4.59368
2646,Wait a Minute!,Willow Dance Wait a Minute!,5.2092255
2647,Chantaje (feat. Maluma),Shakira Dance Chantaje (feat. Maluma),6.3376305
2648,Seeing Blind,Niall Horan Dance Seeing Blind,3.9330999999999996
2649,Outrunning Karma,Alec Benjamin Dance Outrunning Karma,5.41550282
2650,Glad You Came,The Wanted Dance Glad You Came,5.3480159
2651,Lean On,Major Lazer Dance Lean On,5.50819
2652,Don't Stop The Music,Rihanna Dance Don't Stop The Music,5.6844692
2653,Lonely Together (feat. Rita Ora),Avicii Dance Lonely Together (feat. Rita Ora),4.2596282
2654,Truthfully,DNCE Dance Truthfully,4.6406
2655,fOoL fOr YoU,ZAYN Dance fOoL fOr YoU,3.4912
2656,Clandestino,Shakira Dance Clandestino,7.235033700000001
2657,Wrecking Ball,Miley Cyrus Dance Wrecking Ball,4.1362
2658,Foolish,Ashanti Dance Foolish,4.4891
2659,"Too Little, Too Late - Radio Version","JoJo Dance Too Little, Too Late - Radio Version",5.12220107
2660,Dumb Blonde (feat. Nicki Minaj),Avril Lavigne Dance Dumb Blonde (feat. Nicki Minaj),5.1323
2661,Just For A Moment (feat. Iselin),Gryffin Dance Just For A Moment (feat. Iselin),5.4034169
2662,Teenager in Love,Madison Beer Dance Teenager in Love,4.34030582
2663,Me Too,Meghan Trainor Dance Me Too,6.2902012
2664,Year 3000,Jonas Brothers Dance Year 3000,4.79640687
2665,Ayo,Chris Brown Dance Ayo,4.4333
2666,Tequilawine,Olivia O'Brien Dance Tequilawine,5.7002999999999995
2667,YOUTH,Troye Sivan Dance YOUTH,3.9672
2668,Heart Attack,Demi Lovato Dance Heart Attack,4.7707999999999995
2669,Paparazzi,Lady Gaga Dance Paparazzi,3.9073999999999995
2670,Colors,Halsey Dance Colors,4.1461
2671,Chunky,Bruno Mars Dance Chunky,5.760800000000001
2672,Look At Me Now,Chris Brown Dance Look At Me Now,5.666903669999999
2673,Kiwi,Harry Styles Dance Kiwi,4.521739999999999
2674,Summer,Calvin Harris Dance Summer,5.9385
2675,Death Of A Hero,Alec Benjamin Dance Death Of A Hero,5.56900546
2676,Crying in the Club,Camila Cabello Dance Crying in the Club,5.582
2677,Toxic,Britney Spears Dance Toxic,6.5749
2678,borderline (feat. Missy Elliott),Ariana Grande Dance borderline (feat. Missy Elliott),5.1948
2679,Don't Go Breaking My Heart,Backstreet Boys Dance Don't Go Breaking My Heart,3.5881999999999996
2680,Rockabye (feat. Sean Paul & Anne-Marie),Clean Bandit Dance Rockabye (feat. Sean Paul & Anne-Marie),6.3953
2681,Our Song,Taylor Swift Dance Our Song,4.4397
2682,Promiscuous,Nelly Furtado Dance Promiscuous,5.787627499999999
2683,Wildest Dreams,Taylor Swift Dance Wildest Dreams,3.8556000000000004
2684,Replay,Zendaya Dance Replay,5.5978
2685,If I Were a Boy,Beyoncé Dance If I Were a Boy,3.9863
2686,Despacito,Luis Fonsi Dance Despacito,4.590999999999999
2687,The Heart Wants What It Wants,Selena Gomez Dance The Heart Wants What It Wants,5.2867
2688,Baby,Justin Bieber Dance Baby,5.340400000000001
2689,Moonlight,Ariana Grande Dance Moonlight,3.75520355
2690,Barbie Dreams,Nicki Minaj Dance Barbie Dreams,6.295
2691,Getaway Car,Taylor Swift Dance Getaway Car,4.2104522300000005
2692,Follow Your Arrow,Kacey Musgraves Dance Follow Your Arrow,4.209499999999999
2693,Because of You,Kelly Clarkson Dance Because of You,5.0813999999999995
2694,Bye Bye (feat. Ivy Adara),Gryffin Dance Bye Bye (feat. Ivy Adara),4.51591
2695,Planez,Jeremih Dance Planez,4.883
2696,Cold In LA,Why Don't We Dance Cold In LA,4.51500335
2697,Love Song,Sara Bareilles Dance Love Song,5.6289
2698,Careless Whisper,George Michael Dance Careless Whisper,5.8913
2699,Same Old Love,Selena Gomez Dance Same Old Love,4.8286999999999995
2700,Tainted Love,Soft Cell Dance Tainted Love,5.75910643
2701,Pills & Automobiles,Chris Brown Dance Pills & Automobiles,5.943
2702,All Night,The Vamps Dance All Night,4.73483
2703,Trumpets,Jason Derulo Dance Trumpets,4.664000000000001
2704,Faking It,Sasha Sloan Dance Faking It,4.4125000000000005
2705,Play My Music,Jonas Brothers Dance Play My Music,4.753856
2706,The Reason,Chelsea Cutler Dance The Reason,3.7346329
2707,"Flashlight (Sweet Life Mix) - From ""Pitch Perfect 2"" Soundtrack","Hailee Steinfeld Dance Flashlight (Sweet Life Mix) - From ""Pitch Perfect 2"" Soundtrack",4.2181
2708,Like A G6,Far East Movement Dance Like A G6,4.52576
2709,Knees,Bebe Rexha Dance Knees,5.00170102
2710,If I Killed Someone For You,Alec Benjamin Dance If I Killed Someone For You,4.42570291
2711,Common,ZAYN Dance Common,4.8733
2712,Secrets,OneRepublic Dance Secrets,4.3602
2713,Champagne & Sunshine (Ellusive Remix),PLVTINUM Dance Champagne & Sunshine (Ellusive Remix),4.5111
2714,YUSO (feat. Lil Wayne & Saweetie),Kid Ink Dance YUSO (feat. Lil Wayne & Saweetie),4.465082059999999
2715,Bad Intentions,Niykee Heaton Dance Bad Intentions,5.539499999999999
2716,You And I,Lady Gaga Dance You And I,3.8690999999999995
2717,Want You Back,5 Seconds of Summer Dance Want You Back,4.38689103
2718,Greek God,Conan Gray Dance Greek God,4.91240721
2719,OMG,Camila Cabello Dance OMG,4.983099999999999
2720,Say It (feat. Tove Lo),Flume Dance Say It (feat. Tove Lo),4.19500322
2721,Drag Me Down,One Direction Dance Drag Me Down,5.6186
2722,Valentine,5 Seconds of Summer Dance Valentine,5.626410699999999
2723,"Because You Loved Me (Theme from ""Up Close and Personal"")","Céline Dion Dance Because You Loved Me (Theme from ""Up Close and Personal"")",3.8977
2724,Would You Mind,PRETTYMUCH Dance Would You Mind,5.1746300000000005
2725,Me & U,Cassie Dance Me & U,5.496899999999999
2726,Because Of You,Ne-Yo Dance Because Of You,6.019299999999999
2727,Firework,Katy Perry Dance Firework,4.6772
2728,Believe,Cher Dance Believe,4.5479
2729,Like To Be You (feat. Julia Michaels),Shawn Mendes Dance Like To Be You (feat. Julia Michaels),5.308999999999999
2730,Live or Die,Noah Cyrus Dance Live or Die,3.7758999999999996
2731,Greedy,Ariana Grande Dance Greedy,4.5042
2732,Your Side Of The Bed,Loote Dance Your Side Of The Bed,4.9725
2733,blazed (feat. Pharrell Williams),Ariana Grande Dance blazed (feat. Pharrell Williams),4.6046
2734,How Can I Forget,MKTO Dance How Can I Forget,5.0704
2735,"Downtown (feat. Melle Mel, Grandmaster Caz, Kool Moe Dee & Eric Nally)","Macklemore & Ryan Lewis Dance Downtown (feat. Melle Mel, Grandmaster Caz, Kool Moe Dee & Eric Nally)",4.69300121
2736,Lucky Strike,Troye Sivan Dance Lucky Strike,4.7038
2737,She Loves Control,Camila Cabello Dance She Loves Control,4.5649
2738,Winnebago (feat. Quinn XCII & Daniel Wilson),Gryffin Dance Winnebago (feat. Quinn XCII & Daniel Wilson),4.724709170000001
2739,Bad Blood,Taylor Swift Dance Bad Blood,4.26810645
2740,Call It What You Want,Taylor Swift Dance Call It What You Want,4.110321
2741,Am I Wrong,Nico & Vinz Dance Am I Wrong,4.70260213
2742,Quit (feat. Ariana Grande),Cashmere Cat Dance Quit (feat. Ariana Grande),4.2084340000000005
2743,Say Love,James TW Dance Say Love,4.475401290000001
2744,Give Me Everything,Pitbull Dance Give Me Everything,5.266
2745,Level Up,Ciara Dance Level Up,5.007899999999999
2746,Close,Nick Jonas Dance Close,5.360999999999999
2747,Middle Finger,Phoebe Ryan Dance Middle Finger,5.183800000000001
2748,Gangsta,Kehlani Dance Gangsta,4.4866
2749,No Promises (feat. Demi Lovato),Cheat Codes Dance No Promises (feat. Demi Lovato),4.1822
2750,Friends (with BloodPop®),Justin Bieber Dance Friends (with BloodPop®),4.78152
2751,What Makes You Beautiful,One Direction Dance What Makes You Beautiful,4.69811
2752,You Know You Like It,DJ Snake Dance You Know You Like It,5.51830127
2753,Fingers,ZAYN Dance Fingers,5.16300901
2754,Best Thing I Never Had,Beyoncé Dance Best Thing I Never Had,3.8658157000000006
2755,Finest Hour (feat. Abir),Cash Cash Dance Finest Hour (feat. Abir),5.2164
2756,Partition,Beyoncé Dance Partition,5.140200000000001
2757,Sola,Luis Fonsi Dance Sola,5.978800000000001
2758,Let You Go,Nightcall Dance Let You Go,4.79392
2759,Complicated,Olivia O'Brien Dance Complicated,3.8176270000000003
2760,Right Now,Nick Jonas Dance Right Now,5.6056
2761,Perfect To Me,Anne-Marie Dance Perfect To Me,4.7023
2762,Alone (Feat. Big Sean & Stefflon Don),Halsey Dance Alone (Feat. Big Sean & Stefflon Don),5.4774
2763,Adorn,Miguel Dance Adorn,5.0453407
2764,Dollhouse,Melanie Martinez Dance Dollhouse,6.156599999999999
2765,Mad Hatter,Melanie Martinez Dance Mad Hatter,3.9449999999999994
2766,When I Look At You,Miley Cyrus Dance When I Look At You,3.4386
2767,How Deep Is Your Love,Calvin Harris Dance How Deep Is Your Love,5.9147099999999995
2768,Worst In Me,Julia Michaels Dance Worst In Me,3.6156
2769,Steal My Girl,One Direction Dance Steal My Girl,4.97403
2770,Toothbrush,DNCE Dance Toothbrush,4.933
2771,Angel,Shaggy Dance Angel,4.3559
2772,King Of My Heart,Taylor Swift Dance King Of My Heart,3.69312221
2773,Big Girls Don't Cry (Personal),Fergie Dance Big Girls Don't Cry (Personal),4.302099999999999
2774,"Honey, I'm Good.","Andy Grammer Dance Honey, I'm Good.",4.59
2775,Do It Again,Pia Mia Dance Do It Again,3.9904
2776,Killer Queen,5 Seconds of Summer Dance Killer Queen,4.4442200000000005
2777,What I Need (feat. Kehlani),Hayley Kiyoko Dance What I Need (feat. Kehlani),4.1727
2778,Day Dreaming,Jack & Jack Dance Day Dreaming,3.89390976
2779,Country Grammar (Hot Shit),Nelly Dance Country Grammar (Hot Shit),4.669020000000001
2780,Bartender,T-Pain Dance Bartender,3.8641
2781,Let Me,ZAYN Dance Let Me,4.14430593
2782,Down,Jay Sean Dance Down,4.9858
2783,Control,Halsey Dance Control,5.1112
2784,Disturbia,Rihanna Dance Disturbia,5.7834
2785,Don't Kill My High,Lost Kings Dance Don't Kill My High,4.9267
2786,Everybody (Backstreet's Back) - Radio Edit,Backstreet Boys Dance Everybody (Backstreet's Back) - Radio Edit,5.219203270000001
2787,Too Much (feat. Timbaland),ZAYN Dance Too Much (feat. Timbaland),3.5978829999999995
2788,Live Your Life (feat. Rihanna),T.I. Dance Live Your Life (feat. Rihanna),5.909
2789,Soarin,Bazzi Dance Soarin,3.4897
2790,Suit & Tie,Justin Timberlake Dance Suit & Tie,5.191
2791,Lust For Life (with The Weeknd),Lana Del Rey Dance Lust For Life (with The Weeknd),5.416130000000001
2792,Patient,Charlie Puth Dance Patient,5.319
2793,Better To Lie (with Jesse & Swae Lee),benny blanco Dance Better To Lie (with Jesse & Swae Lee),5.34760477
2794,Jello,PRETTYMUCH Dance Jello,5.6225
2795,DJ Got Us Fallin' In Love (feat. Pitbull),Usher Dance DJ Got Us Fallin' In Love (feat. Pitbull),5.800800000000001
2796,Green Light,Lorde Dance Green Light,4.035508549999999
2797,Man! I Feel Like A Woman!,Shania Twain Dance Man! I Feel Like A Woman!,5.765
2798,Team,Noah Cyrus Dance Team,3.9973
2799,September Song,JP Cooper Dance September Song,5.0275
2800,Something's Gotta Give,Camila Cabello Dance Something's Gotta Give,4.7029000000000005
2801,Bailando - Spanish Version,Enrique Iglesias Dance Bailando - Spanish Version,4.54670368
2802,I Knew You Were Trouble.,Taylor Swift Dance I Knew You Were Trouble.,3.76563129
2803,Shape of My Heart,Backstreet Boys Dance Shape of My Heart,4.5256
2804,Rude Boy,Rihanna Dance Rude Boy,4.9758000000000004
2805,Fuck Feelings,Olivia O'Brien Dance Fuck Feelings,5.1223
2806,Black Magic,Little Mix Dance Black Magic,5.2776
2807,Castle,Halsey Dance Castle,4.8643
2808,Goodbye (feat. Nicki Minaj & Willy William),Jason Derulo Dance Goodbye (feat. Nicki Minaj & Willy William),4.9205
2809,"When Will My Life Begin? - From ""Tangled"" / Soundtrack Version","Mandy Moore Dance When Will My Life Begin? - From ""Tangled"" / Soundtrack Version",3.4883999999999995
2810,He Could Be the One,Hannah Montana Dance He Could Be the One,4.49454
2811,Fast Car,Jonas Blue Dance Fast Car,4.610399999999999
2812,Walls Could Talk,Halsey Dance Walls Could Talk,3.7743
2813,If I Could Turn Back Time,Cher Dance If I Could Turn Back Time,4.1908
2814,Thinking Bout You,Ariana Grande Dance Thinking Bout You,3.7593869999999994
2815,What Goes Around.../...Comes Around (Interlude),Justin Timberlake Dance What Goes Around.../...Comes Around (Interlude),4.800935
2816,Use Somebody - Recorded at Spotify Studios NYC,Shawn Mendes Dance Use Somebody - Recorded at Spotify Studios NYC,4.0511
2817,Before I Cry,Lady Gaga Dance Before I Cry,3.8693
2818,This Is Why We Can’t Have Nice Things,Taylor Swift Dance This Is Why We Can’t Have Nice Things,4.5116000000000005
2819,Glamorous,Fergie Dance Glamorous,4.8951
2820,Time After Time,Cyndi Lauper Dance Time After Time,4.33200119
2821,Dress,Taylor Swift Dance Dress,3.4453000000000005
2822,Lush Life,Zara Larsson Dance Lush Life,6.026
2823,Nobody Else But You,Trey Songz Dance Nobody Else But You,5.1901
2824,Clarity,Zedd Dance Clarity,3.9917
2825,Morning,Marc E. Bassy Dance Morning,3.9556999999999998
2826,Cool for the Summer,Demi Lovato Dance Cool for the Summer,4.772657
2827,Talk,Why Don't We Dance Talk,5.6625000000000005
2828,Familiar,Liam Payne Dance Familiar,5.0654
2829,Lie To Me,5 Seconds of Summer Dance Lie To Me,4.3314
2830,My Humps,The Black Eyed Peas Dance My Humps,4.50200405
2831,My Way,Calvin Harris Dance My Way,6.0602371999999995
2832,"Jumpin', Jumpin'","Destiny's Child Dance Jumpin', Jumpin'",4.234400000000001
2833,The Edge Of Glory,Lady Gaga Dance The Edge Of Glory,3.7325429999999993
2834,You & I,One Direction Dance You & I,3.8579999999999997
2835,S&M,Rihanna Dance S&M,4.5503656
2836,Open Arms,PRETTYMUCH Dance Open Arms,5.0951
2837,Love You Like A Love Song,Selena Gomez & The Scene Dance Love You Like A Love Song,5.8651
2838,...Baby One More Time,Britney Spears Dance ...Baby One More Time,6.273831
2839,Light It Up - Remix,Major Lazer Dance Light It Up - Remix,5.723732999999999
2840,Don't Speak,No Doubt Dance Don't Speak,4.9183133
2841,Who Says,Selena Gomez & The Scene Dance Who Says,4.6932
2842,Whatcha Say,Jason Derulo Dance Whatcha Say,4.330299999999999
2843,"Just Like Fire (From the Original Motion Picture ""Alice Through The Looking Glass"")","P!nk Dance Just Like Fire (From the Original Motion Picture ""Alice Through The Looking Glass"")",4.485399999999999
2844,"Hey Mama (feat. Nicki Minaj, Bebe Rexha & Afrojack)","David Guetta Dance Hey Mama (feat. Nicki Minaj, Bebe Rexha & Afrojack)",4.06
2845,Team,Lorde Dance Team,4.2294
2846,U Got It Bad,Usher Dance U Got It Bad,4.27500153
2847,New Flame,Chris Brown Dance New Flame,4.2583
2848,What Is Love,Haddaway Dance What Is Love,5.44639
2849,Don't Leave,Snakehips Dance Don't Leave,4.4303
2850,It's Gonna Be Me,*NSYNC Dance It's Gonna Be Me,5.70590127
2851,Rebels,Ivy Adara Dance Rebels,3.7266999999999992
2852,Beautiful Trauma,P!nk Dance Beautiful Trauma,3.90530255
2853,Upper West Side,King Princess Dance Upper West Side,4.147139999999999
2854,Hot N Cold,Katy Perry Dance Hot N Cold,4.4236794999999995
2855,Born To Die,Lana Del Rey Dance Born To Die,4.5579822
2856,Chances,Backstreet Boys Dance Chances,4.1206
2857,Alejandro,Lady Gaga Dance Alejandro,4.794569999999999
2858,New,Daya Dance New,4.3607247000000005
2859,Single Ladies (Put a Ring on It),Beyoncé Dance Single Ladies (Put a Ring on It),4.359299999999999
2860,Idk Love,Jeremy Zucker Dance Idk Love,4.517
2861,Womanizer,Britney Spears Dance Womanizer,4.2951
2862,What's Luv? (feat. Ja-Rule & Ashanti),Fat Joe Dance What's Luv? (feat. Ja-Rule & Ashanti),4.8087219
2863,Hair Body Face,Lady Gaga Dance Hair Body Face,4.9069532
2864,El Clavo - Remix,Prince Royce Dance El Clavo - Remix,6.2006
2865,"1, 2, 3 (feat. Jason Derulo & De La Ghetto)","Sofia Reyes Dance 1, 2, 3 (feat. Jason Derulo & De La Ghetto)",6.235
2866,Two Ghosts,Harry Styles Dance Two Ghosts,4.46770186
2867,The Way I Are,Timbaland Dance The Way I Are,6.4239999999999995
2868,Habits (Stay High) - Hippie Sabotage Remix,Tove Lo Dance Habits (Stay High) - Hippie Sabotage Remix,5.367579999999999
2869,Pity Party,Melanie Martinez Dance Pity Party,5.123407320000001
2870,Stronger (What Doesn't Kill You),Kelly Clarkson Dance Stronger (What Doesn't Kill You),4.2915
2871,Bloom,Troye Sivan Dance Bloom,4.5488
2872,Never Gonna Give You Up,Rick Astley Dance Never Gonna Give You Up,4.6539435000000005
2873,I Don't Mind (feat. Juicy J),Usher Dance I Don't Mind (feat. Juicy J),4.3042
2874,Fancy,Iggy Azalea Dance Fancy,5.0792
2875,Bad,Lennon Stella Dance Bad,4.765112500000001
2876,Boom Boom Pow,The Black Eyed Peas Dance Boom Boom Pow,4.302573
2877,Style,Taylor Swift Dance Style,3.62619
2878,Wild Ones (feat. Sia),Flo Rida Dance Wild Ones (feat. Sia),5.7675
2879,Nobody Compares To You (feat. Katie Pearlman),Gryffin Dance Nobody Compares To You (feat. Katie Pearlman),4.1149000000000004
2880,Blind,PRETTYMUCH Dance Blind,4.1713000000000005
2881,selfish,Jeremy Zucker Dance selfish,4.393999999999999
2882,Solid,Trey Songz Dance Solid,5.2295
2883,Sex With Me,Rihanna Dance Sex With Me,4.8119000000000005
2884,1994,Alec Benjamin Dance 1994,4.56620352
2885,Turn Down for What,DJ Snake Dance Turn Down for What,5.12557
2886,I'm N Luv (Wit a Stripper) (feat. Mike Jones),T-Pain Dance I'm N Luv (Wit a Stripper) (feat. Mike Jones),3.9642399999999998
2887,Chained To The Rhythm,Katy Perry Dance Chained To The Rhythm,4.8764
